{"contractVersion":"blazing-battle-puppet-atlas-v1","unitId":"scorpion","coordinateSystem":"native-source-pixels-y-down","atlas":{"image":"assets/characters/scorpion/puppet/v2/runtime/scorpion_puppet_v2_runtime_atlas.png","map":"assets/characters/scorpion/puppet/v2/runtime/scorpion_puppet_v2_runtime_atlas.json","width":2720,"height":1560},"requiredSlots":["head","torso","leftUpperArm","rightUpperArm","pelvis","leftForearm","leftHand","rightForearm","rightHand","leftUpperLeg","leftLowerLeg","leftFoot","rightUpperLeg","rightLowerLeg","rightFoot"],"bones":[{"id":"root","parent":null,"restOffset":[0,0],"restRotation":0},{"id":"pelvis","parent":"root","restOffset":[0,-490],"restRotation":0},{"id":"torso","parent":"pelvis","restOffset":[0,-15],"restRotation":0},{"id":"head","parent":"torso","restOffset":[15,-200],"restRotation":0},{"id":"leftShoulder","parent":"torso","restOffset":[-90,-145],"restRotation":0},{"id":"leftElbow","parent":"leftShoulder","restOffset":[-20,60],"restRotation":0},{"id":"leftWrist","parent":"leftElbow","restOffset":[5,150],"restRotation":0},{"id":"rightShoulder","parent":"torso","restOffset":[130,-145],"restRotation":0},{"id":"rightElbow","parent":"rightShoulder","restOffset":[20,60],"restRotation":0},{"id":"rightWrist","parent":"rightElbow","restOffset":[5,150],"restRotation":0},{"id":"leftHip","parent":"pelvis","restOffset":[-20,195],"restRotation":0},{"id":"leftKnee","parent":"leftHip","restOffset":[-25,72],"restRotation":0},{"id":"leftAnkle","parent":"leftKnee","restOffset":[10,115],"restRotation":0},{"id":"rightHip","parent":"pelvis","restOffset":[60,211],"restRotation":0},{"id":"rightKnee","parent":"rightHip","restOffset":[20,67],"restRotation":0},{"id":"rightAnkle","parent":"rightKnee","restOffset":[-5,104],"restRotation":0}],"components":[{"slot":"rightUpperLeg","covers":[],"parentBone":"rightHip","attachmentPoint":[0,0],"zOrder":10,"defaultAttachment":"v2_right_upper_leg","attachments":[{"id":"v2_right_upper_leg","sourceRegion":"v2_right_upper_leg","atlasRect":{"x":128,"y":1168,"w":148,"h":125},"pivot":[45,20],"restOffset":[0,0],"restRotation":0,"mirrorEligible":false,"nativeAspectRatio":1.184}]},{"slot":"rightLowerLeg","covers":[],"parentBone":"rightKnee","attachmentPoint":[0,0],"zOrder":11,"defaultAttachment":"v2_right_lower_leg","attachments":[{"id":"v2_right_lower_leg","sourceRegion":"v2_right_lower_leg","atlasRect":{"x":1216,"y":1168,"w":148,"h":131},"pivot":[65,15],"restOffset":[0,0],"restRotation":0,"mirrorEligible":false,"nativeAspectRatio":1.1297709923664123}]},{"slot":"rightFoot","covers":[],"parentBone":"rightAnkle","attachmentPoint":[0,0],"zOrder":12,"defaultAttachment":"v2_right_foot","attachments":[{"id":"v2_right_foot","sourceRegion":"v2_right_foot","atlasRect":{"x":2304,"y":1168,"w":90,"h":116},"pivot":[45,8],"restOffset":[0,0],"restRotation":0,"mirrorEligible":false,"nativeAspectRatio":0.7758620689655172}]},{"slot":"leftUpperLeg","covers":[],"parentBone":"leftHip","attachmentPoint":[0,0],"zOrder":20,"defaultAttachment":"v2_left_upper_leg","attachments":[{"id":"v2_left_upper_leg","sourceRegion":"v2_left_upper_leg","atlasRect":{"x":2304,"y":648,"w":160,"h":127},"pivot":[105,20],"restOffset":[0,0],"restRotation":0,"mirrorEligible":false,"nativeAspectRatio":1.2598425196850394}]},{"slot":"leftLowerLeg","covers":[],"parentBone":"leftKnee","attachmentPoint":[0,0],"zOrder":21,"defaultAttachment":"v2_left_lower_leg","attachments":[{"id":"v2_left_lower_leg","sourceRegion":"v2_left_lower_leg","atlasRect":{"x":672,"y":1168,"w":160,"h":130},"pivot":[80,15],"restOffset":[0,0],"restRotation":0,"mirrorEligible":false,"nativeAspectRatio":1.2307692307692308}]},{"slot":"leftFoot","covers":[],"parentBone":"leftAnkle","attachmentPoint":[0,0],"zOrder":22,"defaultAttachment":"v2_left_foot","attachments":[{"id":"v2_left_foot","sourceRegion":"v2_left_foot","atlasRect":{"x":1760,"y":1168,"w":90,"h":116},"pivot":[45,8],"restOffset":[0,0],"restRotation":0,"mirrorEligible":false,"nativeAspectRatio":0.7758620689655172}]},{"slot":"rightUpperArm","covers":[],"parentBone":"rightShoulder","attachmentPoint":[0,0],"zOrder":40,"defaultAttachment":"v2_right_upper_arm","attachments":[{"id":"v2_right_upper_arm","sourceRegion":"v2_right_upper_arm","atlasRect":{"x":2304,"y":128,"w":149,"h":120},"pivot":[35,30],"restOffset":[0,0],"restRotation":0,"mirrorEligible":false,"nativeAspectRatio":1.2416666666666667}]},{"slot":"rightForearm","covers":[],"parentBone":"rightElbow","attachmentPoint":[0,0],"zOrder":41,"defaultAttachment":"v2_right_forearm","attachments":[{"id":"v2_right_forearm","sourceRegion":"v2_right_forearm","atlasRect":{"x":672,"y":648,"w":149,"h":155},"pivot":[55,15],"restOffset":[0,0],"restRotation":0,"mirrorEligible":false,"nativeAspectRatio":0.9612903225806452}]},{"slot":"rightHand","covers":[],"parentBone":"rightWrist","attachmentPoint":[0,0],"zOrder":42,"defaultAttachment":"v2_right_hand","attachments":[{"id":"v2_right_hand","sourceRegion":"v2_right_hand","atlasRect":{"x":1760,"y":648,"w":78,"h":93},"pivot":[35,25],"restOffset":[0,0],"restRotation":0,"mirrorEligible":false,"nativeAspectRatio":0.8387096774193549}]},{"slot":"torso","covers":[],"parentBone":"torso","attachmentPoint":[0,0],"zOrder":50,"defaultAttachment":"v2_torso","attachments":[{"id":"v2_torso","sourceRegion":"v2_torso","atlasRect":{"x":672,"y":128,"w":273,"h":208},"pivot":[135,195],"restOffset":[0,0],"restRotation":0,"mirrorEligible":false,"nativeAspectRatio":1.3125}]},{"slot":"pelvis","covers":[],"parentBone":"pelvis","attachmentPoint":[0,0],"zOrder":55,"defaultAttachment":"v2_pelvis","attachments":[{"id":"v2_pelvis","sourceRegion":"v2_pelvis","atlasRect":{"x":1216,"y":128,"w":261,"h":251},"pivot":[130,20],"restOffset":[0,0],"restRotation":0,"mirrorEligible":false,"nativeAspectRatio":1.0398406374501992}]},{"slot":"leftUpperArm","covers":[],"parentBone":"leftShoulder","attachmentPoint":[0,0],"zOrder":60,"defaultAttachment":"v2_left_upper_arm","attachments":[{"id":"v2_left_upper_arm","sourceRegion":"v2_left_upper_arm","atlasRect":{"x":1760,"y":128,"w":148,"h":120},"pivot":[110,30],"restOffset":[0,0],"restRotation":0,"mirrorEligible":false,"nativeAspectRatio":1.2333333333333334}]},{"slot":"leftForearm","covers":[],"parentBone":"leftElbow","attachmentPoint":[0,0],"zOrder":61,"defaultAttachment":"v2_left_forearm","attachments":[{"id":"v2_left_forearm","sourceRegion":"v2_left_forearm","atlasRect":{"x":128,"y":648,"w":148,"h":155},"pivot":[90,15],"restOffset":[0,0],"restRotation":0,"mirrorEligible":false,"nativeAspectRatio":0.9548387096774194}]},{"slot":"leftHand","covers":[],"parentBone":"leftWrist","attachmentPoint":[0,0],"zOrder":62,"defaultAttachment":"v2_left_hand","attachments":[{"id":"v2_left_hand","sourceRegion":"v2_left_hand","atlasRect":{"x":1216,"y":648,"w":85,"h":93},"pivot":[45,25],"restOffset":[0,0],"restRotation":0,"mirrorEligible":false,"nativeAspectRatio":0.9139784946236559}]},{"slot":"head","covers":[],"parentBone":"head","attachmentPoint":[0,0],"zOrder":100,"defaultAttachment":"v2_head","attachments":[{"id":"v2_head","sourceRegion":"v2_head","atlasRect":{"x":128,"y":128,"w":168,"h":203},"pivot":[85,180],"restOffset":[0,0],"restRotation":0,"mirrorEligible":false,"nativeAspectRatio":0.8275862068965517}]}],"neutral":{"visualBounds":{"x":-200,"y":-885,"w":444,"h":885},"baseline":0,"anchorX":22,"footTolerance":2,"feet":[{"slot":"leftFoot","point":[45,116]},{"slot":"rightFoot","point":[45,116]}]},"normalization":{"stage":"whole-character-only","anchor":"bottom-center","authority":"existing-fighter-visual-contract"},"fallback":"existing-frame-animation","supportedStates":["neutral"]}