{"contractVersion":"blazing-battle-puppet-atlas-v1","unitId":"scorpion","coordinateSystem":"native-source-pixels-y-down","atlas":{"image":"assets/characters/scorpion/puppet/v3/runtime/scorpion_puppet_v3_runtime_atlas.webp","map":"assets/characters/scorpion/puppet/v3/runtime/scorpion_puppet_v3_runtime_atlas.json","width":2048,"height":2304},"requiredSlots":["head","torso","leftUpperArm","rightUpperArm","pelvis","leftForearm","leftHand","rightForearm","rightHand","leftUpperLeg","leftLowerLeg","leftFoot","rightUpperLeg","rightLowerLeg","rightFoot"],"bones":[{"id":"root","parent":null,"restOffset":[36,-932],"restRotation":0},{"id":"pelvis","parent":"root","restOffset":[0,0],"restRotation":0},{"id":"torso","parent":"pelvis","restOffset":[0,-195],"restRotation":0},{"id":"head","parent":"torso","restOffset":[42,-105],"restRotation":0},{"id":"leftShoulder","parent":"torso","restOffset":[-203,-55],"restRotation":0},{"id":"leftElbow","parent":"leftShoulder","restOffset":[-90,170],"restRotation":0},{"id":"leftWrist","parent":"leftElbow","restOffset":[-20,225],"restRotation":0},{"id":"rightShoulder","parent":"torso","restOffset":[167,0],"restRotation":0},{"id":"rightElbow","parent":"rightShoulder","restOffset":[50,145],"restRotation":0},{"id":"rightWrist","parent":"rightElbow","restOffset":[85,200],"restRotation":0},{"id":"leftHip","parent":"pelvis","restOffset":[-128,105],"restRotation":0},{"id":"leftKnee","parent":"leftHip","restOffset":[-60,355],"restRotation":0},{"id":"leftAnkle","parent":"leftKnee","restOffset":[-70,275],"restRotation":0},{"id":"rightHip","parent":"pelvis","restOffset":[97,115],"restRotation":0},{"id":"rightKnee","parent":"rightHip","restOffset":[130,365],"restRotation":0},{"id":"rightAnkle","parent":"rightKnee","restOffset":[-15,250],"restRotation":0}],"components":[{"slot":"rightUpperLeg","covers":[],"parentBone":"rightHip","attachmentPoint":[0,0],"zOrder":0,"defaultAttachment":"v3_rightUpperLeg","attachments":[{"id":"v3_rightUpperLeg","sourceRegion":"13_right_thigh","atlasRect":{"x":96,"y":96,"w":399,"h":455},"pivot":[58,73],"restOffset":[0,0],"restRotation":0,"mirrorEligible":false,"nativeAspectRatio":0.8769230769230769}]},{"slot":"rightFoot","covers":[],"parentBone":"rightAnkle","attachmentPoint":[0,0],"zOrder":1,"defaultAttachment":"v3_rightFoot","attachments":[{"id":"v3_rightFoot","sourceRegion":"15_right_foot","atlasRect":{"x":591,"y":96,"w":450,"h":229},"pivot":[229,26],"restOffset":[0,0],"restRotation":0,"mirrorEligible":false,"nativeAspectRatio":1.965065502183406}]},{"slot":"rightLowerLeg","covers":[],"parentBone":"rightKnee","attachmentPoint":[0,0],"zOrder":2,"defaultAttachment":"v3_rightLowerLeg","attachments":[{"id":"v3_rightLowerLeg","sourceRegion":"14_right_shin","atlasRect":{"x":1137,"y":96,"w":435,"h":411},"pivot":[238,80],"restOffset":[0,0],"restRotation":0,"mirrorEligible":false,"nativeAspectRatio":1.0583941605839415}]},{"slot":"rightUpperArm","covers":[],"parentBone":"rightShoulder","attachmentPoint":[0,0],"zOrder":3,"defaultAttachment":"v3_rightUpperArm","attachments":[{"id":"v3_rightUpperArm","sourceRegion":"07_right_upper_arm","atlasRect":{"x":1668,"y":96,"w":77,"h":239},"pivot":[9,49],"restOffset":[0,0],"restRotation":0,"mirrorEligible":false,"nativeAspectRatio":0.32217573221757323}]},{"slot":"rightHand","covers":[],"parentBone":"rightWrist","attachmentPoint":[0,0],"zOrder":4,"defaultAttachment":"v3_rightHand","attachments":[{"id":"v3_rightHand","sourceRegion":"09_right_hand","atlasRect":{"x":96,"y":647,"w":210,"h":141},"pivot":[50,2],"restOffset":[0,0],"restRotation":0,"mirrorEligible":false,"nativeAspectRatio":1.4893617021276595}]},{"slot":"rightForearm","covers":[],"parentBone":"rightElbow","attachmentPoint":[0,0],"zOrder":5,"defaultAttachment":"v3_rightForearm","attachments":[{"id":"v3_rightForearm","sourceRegion":"08_right_forearm","atlasRect":{"x":402,"y":647,"w":185,"h":310},"pivot":[38,49],"restOffset":[0,0],"restRotation":0,"mirrorEligible":false,"nativeAspectRatio":0.5967741935483871}]},{"slot":"leftUpperLeg","covers":[],"parentBone":"leftHip","attachmentPoint":[0,0],"zOrder":6,"defaultAttachment":"v3_leftUpperLeg","attachments":[{"id":"v3_leftUpperLeg","sourceRegion":"10_left_thigh","atlasRect":{"x":683,"y":647,"w":423,"h":406},"pivot":[335,36],"restOffset":[0,0],"restRotation":0,"mirrorEligible":false,"nativeAspectRatio":1.041871921182266}]},{"slot":"leftFoot","covers":[],"parentBone":"leftAnkle","attachmentPoint":[0,0],"zOrder":7,"defaultAttachment":"v3_leftFoot","attachments":[{"id":"v3_leftFoot","sourceRegion":"12_left_foot","atlasRect":{"x":1202,"y":647,"w":466,"h":203},"pivot":[226,2],"restOffset":[0,0],"restRotation":0,"mirrorEligible":false,"nativeAspectRatio":2.2955665024630543}]},{"slot":"leftLowerLeg","covers":[],"parentBone":"leftKnee","attachmentPoint":[0,0],"zOrder":8,"defaultAttachment":"v3_leftLowerLeg","attachments":[{"id":"v3_leftLowerLeg","sourceRegion":"11_left_shin","atlasRect":{"x":96,"y":1149,"w":471,"h":416},"pivot":[311,65],"restOffset":[0,0],"restRotation":0,"mirrorEligible":false,"nativeAspectRatio":1.1322115384615385}]},{"slot":"leftUpperArm","covers":[],"parentBone":"leftShoulder","attachmentPoint":[0,0],"zOrder":9,"defaultAttachment":"v3_leftUpperArm","attachments":[{"id":"v3_leftUpperArm","sourceRegion":"04_left_upper_arm","atlasRect":{"x":663,"y":1149,"w":127,"h":212},"pivot":[118,61],"restOffset":[0,0],"restRotation":0,"mirrorEligible":false,"nativeAspectRatio":0.5990566037735849}]},{"slot":"leftHand","covers":[],"parentBone":"leftWrist","attachmentPoint":[0,0],"zOrder":10,"defaultAttachment":"v3_leftHand","attachments":[{"id":"v3_leftHand","sourceRegion":"06_left_hand","atlasRect":{"x":886,"y":1149,"w":342,"h":133},"pivot":[235,7],"restOffset":[0,0],"restRotation":0,"mirrorEligible":false,"nativeAspectRatio":2.5714285714285716}]},{"slot":"leftForearm","covers":[],"parentBone":"leftElbow","attachmentPoint":[0,0],"zOrder":11,"defaultAttachment":"v3_leftForearm","attachments":[{"id":"v3_leftForearm","sourceRegion":"05_left_forearm","atlasRect":{"x":1324,"y":1149,"w":200,"h":320},"pivot":[110,59],"restOffset":[0,0],"restRotation":0,"mirrorEligible":false,"nativeAspectRatio":0.625}]},{"slot":"torso","covers":[],"parentBone":"torso","attachmentPoint":[0,0],"zOrder":12,"defaultAttachment":"v3_torso","attachments":[{"id":"v3_torso","sourceRegion":"02_torso","atlasRect":{"x":96,"y":1661,"w":444,"h":285},"pivot":[246,135],"restOffset":[0,0],"restRotation":0,"mirrorEligible":false,"nativeAspectRatio":1.5578947368421052}]},{"slot":"pelvis","covers":[],"parentBone":"pelvis","attachmentPoint":[0,0],"zOrder":13,"defaultAttachment":"v3_pelvis","attachments":[{"id":"v3_pelvis","sourceRegion":"03_pelvis","atlasRect":{"x":636,"y":1661,"w":483,"h":511},"pivot":[233,55],"restOffset":[0,0],"restRotation":0,"mirrorEligible":false,"nativeAspectRatio":0.9452054794520548}]},{"slot":"head","covers":[],"parentBone":"head","attachmentPoint":[0,0],"zOrder":14,"defaultAttachment":"v3_head","attachments":[{"id":"v3_head","sourceRegion":"01_head_hood","atlasRect":{"x":1215,"y":1661,"w":603,"h":327},"pivot":[353,276],"restOffset":[0,0],"restRotation":0,"mirrorEligible":false,"nativeAspectRatio":1.8440366972477065}]}],"neutral":{"visualBounds":{"x":-362,"y":-1505,"w":829,"h":1505},"baseline":0,"anchorX":0,"footTolerance":2,"feet":[{"slot":"leftFoot","point":[198,199]},{"slot":"rightFoot","point":[357,228]}]},"normalization":{"stage":"whole-character-only","anchor":"bottom-center","authority":"existing-fighter-visual-contract"},"fallback":"existing-frame-animation","supportedStates":["neutral"]}